{
  "$schema": "../_schemas/pack-manifest.schema.json",
  "id": "vocabpack-source-taxonomy",
  "kind": "vocabpack",
  "version": "0.1.0",
  "title": "Source Taxonomy Vocabulary Pack",
  "summary": "Starter taxonomy for infrastructure, repository, and volatility classes plus source tiers.",
  "entrypoints": {
    "examples": ["examples/tiering-and-trust.md"],
    "schema": [],
    "shacl": [],
    "tests": ["tests/README.md"],
    "vocab": ["vocab/source-taxonomy.ttl"]
  },
  "dependsOn": ["stdpack-source-substrate"]
}
